specialty_id,specialty_name,service_id,service_name,service_desc,service_name_vn,service_desc_vn,is_advanced,intensity_level
11900,Medical Oncology,11902,"Chemotherapy Treatment","Chemotherapy treatments tailored to specific cancer types and stages.","Điều trị hóa trị","Các liệu pháp hóa trị được điều chỉnh cho từng loại ung thư cụ thể và mức độ.",No,0
11900,Medical Oncology,11903,"Immunotherapy","Immunotherapy for cancer, including immune checkpoint inhibitors and targeted therapy.","Immunotherapy cho ung thư","Immunotherapy cho ung thư, bao gồm các chất ức chế điểm kiểm soát miễn dịch và điều trị nhắm mục tiêu.",No,0
11900,Medical Oncology,11904,"Radiation Therapy","External and internal radiation therapy for cancer treatment, with personalized plans.","Điều trị bằng tia X","Điều trị ung thư bằng tia X từ ngoài và từ bên trong, với kế hoạch cá nhân hóa.",No,0
11900,Medical Oncology,11905,"Cancer Surgery Consultation","Consultations for cancer surgery, including surgical recommendations and planning.","Tư vấn phẫu thuật ung thư","Tư vấn về phẫu thuật ung thư, bao gồm đề xuất và lập kế hoạch phẫu thuật.",No,2
11900,Medical Oncology,11906,"Palliative Care for Cancer Patients","Palliative care services to improve the quality of life for cancer patients.","Chăm sóc giảm nhẹ cho bệnh nhân ung thư","Các dịch vụ chăm sóc giảm nhẹ để cải thiện chất lượng cuộc sống cho bệnh nhân ung thư.",No,2
11900,Medical Oncology,11907,"Clinical Trials Participation","Participation in clinical trials for experimental cancer treatments and research.","Tham gia thử nghiệm lâm sàng","Tham gia các thử nghiệm lâm sàng để thử nghiệm các liệu pháp điều trị ung thư thử nghiệm và nghiên cứu.",No,2
11900,Medical Oncology,11908,"Cancer Genetic Counseling","Genetic counseling to assess cancer risk and provide recommendations.","Tư vấn di truyền ung thư","Tư vấn di truyền để đánh giá rủi ro ung thư và đưa ra đề xuất.",No,2
11900,Medical Oncology,11909,"Cancer Survivorship Programs","Programs and support for cancer survivors to manage post-treatment challenges.","Chương trình dành cho người sống sót sau ung thư","Chương trình và hỗ trợ cho người sống sót sau ung thư để quản lý các thách thức sau điều trị.",No,2
11900,Medical Oncology,11910,"Targeted Therapy","Targeted therapy for specific cancer types with drugs that target cancer cell functions.","Điều trị nhắm mục tiêu","Điều trị nhắm mục tiêu cho các loại ung thư cụ thể bằng các loại thuốc nhắm mục tiêu chức năng tế bào ung thư.",No,0
12100,Hematology,12101,"Blood Disorders Diagnosis","Diagnosis of various blood disorders, including anemia, clotting disorders, and blood cancers.","Chẩn đoán các rối loạn máu","Chẩn đoán các rối loạn máu khác nhau, bao gồm thiếu máu, rối loạn đông máu và các bệnh ung thư máu.",No,2
12100,Hematology,12102,"Hemophilia Management","Comprehensive care and treatment for individuals with hemophilia, including clotting factor replacement.","Quản lý bệnh đông máu giảm","Chăm sóc và điều trị toàn diện cho người mắc bệnh đông máu giảm, bao gồm thay thế yếu tố đông máu.",No,2
12100,Hematology,12103,"Iron-deficiency Anemia Treatment","Treatment for iron-deficiency anemia, including iron supplementation and dietary advice.","Điều trị thiếu máu sắt","Điều trị thiếu máu sắt, bao gồm bổ sung sắt và lời khuyên dinh dưỡng.",No,2
12100,Hematology,12104,"Leukemia Diagnosis and Care","Diagnosis and care for various types of leukemia, with personalized treatment plans.","Chẩn đoán và quản lý bệnh bạch cầu","Chẩn đoán và quản lý các loại bạch cầu khác nhau, với kế hoạch điều trị cá nhân hóa.",No,2
12100,Hematology,12105,"Thalassemia Treatment","Comprehensive care and treatment for individuals with thalassemia, including blood transfusions.","Quản lý bệnh thiếu máu thalassemia","Chăm sóc và điều trị toàn diện cho người mắc bệnh thiếu máu thalassemia, bao gồm truyền máu.",No,2
12100,Hematology,12106,"Myeloma Treatment","Treatment for multiple myeloma, including chemotherapy, stem cell transplantation, and targeted therapy.","Điều trị bệnh u tủy","Điều trị bệnh u tủy, bao gồm hóa trị, cấy tủy xương và điều trị nhắm mục tiêu.",No,0
12100,Hematology,12107,"Platelet Disorders Management","Management of platelet disorders, including medications and lifestyle recommendations.","Quản lý rối loạn tiểu cầu","Quản lý rối loạn tiểu cầu, bao gồm thuốc và đề xuất lối sống.",No,1
12100,Hematology,12108,"Sickle Cell Disease Care","Comprehensive care for individuals with sickle cell disease, including pain management and hydroxyurea treatment.","Chăm sóc bệnh bạch cầu hình lưỡi hái","Chăm sóc toàn diện cho người mắc bệnh bạch cầu hình lưỡi hái, bao gồm quản lý đau và điều trị hydroxyurea.",No,2
12100,Hematology,12109,"Lymphoma Diagnosis and Treatment","Diagnosis and treatment of lymphoma, including chemotherapy and immunotherapy options.","Chẩn đoán và điều trị bệnh hạch cầu","Chẩn đoán và điều trị bệnh hạch cầu, bao gồm lựa chọn hóa trị và cách điều trị miễn dịch.",No,1
12100,Hematology,12110,"Hemoglobinopathy Screening","Screening for hemoglobinopathies, such as sickle cell anemia and thalassemia.","Kiểm tra bệnh họ sắt","Kiểm tra bệnh họ sắt, chẳng hạn như bệnh bạch cầu hình lưỡi hái và thiếu máu thalassemia.",No,1
12200,Dietetics,12201,"Nutritional Assessment","Comprehensive assessment of dietary habits and nutritional status for personalized recommendations.","Đánh giá dinh dưỡng","Đánh giá toàn diện về thói quen ăn uống và tình trạng dinh dưỡng để đưa ra đề xuất cá nhân hóa.",No,4
12200,Dietetics,12202,"Weight Management","Personalized weight management plans, including diet and exercise recommendations.","Quản lý cân nặng","Kế hoạch quản lý cân nặng cá nhân hóa, bao gồm đề xuất dinh dưỡng và tập thể dục.",No,4
12200,Dietetics,12203,"Sports Nutrition","Nutrition advice and meal plans for athletes and active individuals to optimize performance.","Dinh dưỡng thể thao","Lời khuyên dinh dưỡng và kế hoạch bữa ăn dành cho vận động viên và người hoạt động để tối ưu hóa hiệu suất.",No,4
12200,Dietetics,12204,"Pediatric Nutrition","Nutritional guidance for children and infants to ensure healthy growth and development.","Dinh dưỡng trẻ em","Hướng dẫn dinh dưỡng cho trẻ em và trẻ sơ sinh để đảm bảo sự phát triển khỏe mạnh.",No,4
12200,Dietetics,12205,"Eating Disorder Support","Support and counseling for individuals with eating disorders, including anorexia and bulimia.","Hỗ trợ rối loạn ăn uống","Hỗ trợ và tư vấn cho người mắc rối loạn ăn uống, bao gồm loạn ăn và loạn nôn.",No,4
12200,Dietetics,12206,"Gastrointestinal Diet Management","Dietary management for gastrointestinal conditions, including irritable bowel syndrome and celiac disease.","Quản lý dinh dưỡng dạ dày ruột","Quản lý dinh dưỡng cho các tình trạng dạ dày ruột, bao gồm hội chứng ruột kích thích và bệnh celiac.",No,4
12200,Dietetics,12207,"Diabetes Nutrition Counseling","Nutritional counseling for individuals with diabetes, including meal planning and blood sugar control.","Tư vấn dinh dưỡng đái tháo đường","Tư vấn dinh dưỡng cho người mắc bệnh đái tháo đường, bao gồm kế hoạch bữa ăn và kiểm soát đường huyết.",No,4
12200,Dietetics,12208,"Renal Diet Management","Dietary management for kidney-related conditions, including chronic kidney disease and dialysis diets.","Quản lý dinh dưỡng thận","Quản lý dinh dưỡng cho các tình trạng liên quan đến thận, bao gồm bệnh thận mãn tính và chế độ dinh dưỡng cho người trải qua cấy tủy.",No,4
12200,Dietetics,12209,"Food Allergy and Intolerance Guidance","Dietary guidance for individuals with food allergies and intolerances to manage their diet safely.","Hướng dẫn về dị ứng thực phẩm và sự không dung nạp","Hướng dẫn dinh dưỡng cho người có dị ứng thực phẩm và sự không dung nạp để quản lý chế độ ăn uống an toàn.",No,4
12200,Dietetics,12210,"Enteral and Parenteral Nutrition","Provision of nutrition through tube feeding (enteral) or intravenous feeding (parenteral) for those unable to eat orally.","Dinh dưỡng thông qua ống (enteral) và dinh dưỡng qua tĩnh mạch (parenteral)","Cung cấp dinh dưỡng thông qua ống (enteral) hoặc thông qua tĩnh mạch (parenteral) cho những người không thể ăn bằng miệng.",Yes,0
12300,Geriatrics,12301,"Comprehensive Geriatric Assessment","A thorough evaluation of the health and functional status of older adults for personalized care plans.","Đánh giá lâm sàng người già toàn diện","Đánh giá kỹ lưỡng về sức khỏe và trạng thái chức năng của người cao tuổi để lập kế hoạch chăm sóc cá nhân hóa.",No,2
12300,Geriatrics,12302,"Medication Management for Seniors","Optimizing medication regimens for seniors, including reducing polypharmacy.","Quản lý thuốc cho người cao tuổi","Tối ưu hóa kế hoạch điều trị thuốc cho người cao tuổi, bao gồm giảm đa dược.",No,2
12300,Geriatrics,12303,"Fall Prevention and Balance Training","Assessment and training to prevent falls and improve balance in older adults.","Phòng ngã và huấn luyện cân bằng","Đánh giá và huấn luyện để phòng ngã và cải thiện cân bằng cho người cao tuổi.",No,2
12300,Geriatrics,12304,"Memory and Cognitive Function Evaluation","Assessment of memory and cognitive function in older adults, including dementia screening.","Đánh giá trí nhớ và chức năng tư duy","Đánh giá trí nhớ và chức năng tư duy của người cao tuổi, bao gồm kiểm tra chứng sa sút tư duy.",No,2
12300,Geriatrics,12305,"Nutrition and Hydration Management","Dietary and fluid management for seniors to address nutritional needs and hydration status.","Quản lý dinh dưỡng và dưỡng chất","Quản lý dinh dưỡng và dưỡng chất cho người cao tuổi để đáp ứng nhu cầu dinh dưỡng và tình trạng dưỡng chất.",No,4
12300,Geriatrics,12306,"End-of-Life Planning and Care","Support for end-of-life planning, including advanced care directives and palliative care options.","Lập kế hoạch và chăm sóc cuối đời","Hỗ trợ lập kế hoạch cho giai đoạn cuối đời, bao gồm các hướng dẫn chăm sóc tiên tiến và tùy chọn chăm sóc giảm nhẹ.",No,4
12300,Geriatrics,12307,"Mobility Aid Recommendations","Recommendations for mobility aids and assistive devices to enhance independence in daily activities.","Đề xuất hỗ trợ di động","Đề xuất các loại thiết bị hỗ trợ di động để tăng cường độc lập trong các hoạt động hàng ngày.",No,2
12300,Geriatrics,12308,"Vision and Hearing Assessment","Assessment of vision and hearing issues in older adults and recommendations for care.","Đánh giá thị lực và thính lực","Đánh giá vấn đề về thị giác và thính lực ở người cao tuổi và đề xuất biện pháp chăm sóc.",No,3
12300,Geriatrics,12309,"Geriatric Psychiatry","Psychiatric evaluation and care for mental health issues in older adults, including depression and anxiety.","Tâm thần học người già","Đánh giá tâm thần và chăm sóc cho các vấn đề về tâm lý ở người cao tuổi, bao gồm trầm cảm và lo âu.",No,1
12300,Geriatrics,12310,"Home Health Services for Seniors","Coordinating home-based healthcare services to support seniors in their residences.","Dịch vụ chăm sóc sức khỏe tại nhà cho người cao tuổi","Phối hợp các dịch vụ chăm sóc sức khỏe tại nhà để hỗ trợ người cao tuổi tại nơi cư trú của họ.",No,0
12400,Thoracic and Vascular Surgery,12401,"Cardiovascular Surgery","Surgical procedures to treat heart and blood vessel conditions, including bypass surgery and valve repair.","Phẫu thuật tim mạch","Các quy trình phẫu thuật để điều trị bệnh tim và mạch máu, bao gồm phẫu thuật cầu và sửa van.",No,1
12400,Thoracic and Vascular Surgery,12402,"Thoracic Surgery","Surgical treatment for conditions of the chest, including lung resection and chest wall repair.","Phẫu thuật ngực","Điều trị phẫu thuật cho các tình trạng vùng ngực, bao gồm cắt bỏ phổi và sửa ngực.",No,1
12400,Thoracic and Vascular Surgery,12403,"Vascular Surgery","Surgical procedures for blood vessel issues, such as aneurysm repair and bypass grafts.","Phẫu thuật mạch máu","Các quy trình phẫu thuật để điều trị các vấn đề về mạch máu, chẳng hạn như sửa chữa bình phình mạch và cầu qua mạch máu.",No,1
12400,Thoracic and Vascular Surgery,12404,"Endovascular Surgery","Minimally invasive procedures to treat vascular conditions, including stent placement and angioplasty.","Phẫu thuật mạch máu nội soi","Các quy trình tối thiểu xâm nhập để điều trị các tình trạng về mạch máu, bao gồm đặt stent và mở mạch máu.",No,1
12400,Thoracic and Vascular Surgery,12405,"Esophageal Surgery","Surgical treatment for esophageal disorders, including reflux surgery and tumor resection.","Phẫu thuật thực quản","Điều trị phẫu thuật cho các rối loạn về thực quản, bao gồm phẫu thuật trào ngược và cắt bỏ khối u.",No,1
12400,Thoracic and Vascular Surgery,12406,"Lung Surgery","Surgical procedures for lung conditions, such as lobectomy and pneumonectomy.","Phẫu thuật phổi","Các quy trình phẫu thuật cho các tình trạng phổi, chẳng hạn như cắt bỏ một phần phổi và cắt bỏ toàn bộ phổi.",No,1
12400,Thoracic and Vascular Surgery,12407,"Vascular Screening","Screening and diagnostic tests to assess vascular health and detect potential issues.","Kiểm tra mạch máu","Kiểm tra và kiểm tra chẩn đoán để đánh giá sức khỏe mạch máu và phát hiện vấn đề tiềm năng.",No,1
12400,Thoracic and Vascular Surgery,12408,"Pacemaker and ICD Implantation","Implantation of pacemakers and implantable cardioverter-defibrillators (ICDs) to manage heart rhythm disorders.","Đặt bộ điều hòa nhịp tim và ICD","Đặt bộ điều hòa nhịp tim và thiết bị điện chấn trái tim có thể cấy (ICD) để điều trị các rối loạn nhịp tim.",No,1
12400,Thoracic and Vascular Surgery,12409,"Aortic Aneurysm Repair","Surgical repair of aortic aneurysms, including open and endovascular approaches.","Sửa bình phình động mạch chủ","Sửa chữa phẫu thuật các bình phình động mạch chủ, bao gồm phương pháp mở và nội soi.",No,1
12400,Thoracic and Vascular Surgery,12410,"Varicose Vein Treatment","Treatment options for varicose veins, including laser therapy and minimally invasive procedures.","Điều trị tĩnh mạch trĩ nội soi","Các phương pháp điều trị cho tĩnh mạch trĩ, bao gồm điều trị bằng tia laser và các quy trình tối thiểu xâm nhập.",No,1
12500,Ophthalmology,12501,"Comprehensive Eye Examination","A thorough eye examination to assess vision and eye health, including prescription for glasses or contact lenses.","Kiểm tra mắt toàn diện","Kiểm tra mắt kỹ thuật số toàn diện để đánh giá thị lực và sức khỏe mắt, bao gồm viết đơn kính hoặc lens áp tròng.",No,3
12500,Ophthalmology,12502,"Cataract Surgery","Surgical removal of cataracts and replacement with intraocular lenses to restore clear vision.","Phẫu thuật đục thủy tinh","Cắt bỏ đục thủy tinh và thay thế bằng kính thủy tinh trong mắt để khôi phục thị lực rõ ràng.",No,1
12500,Ophthalmology,12503,"Glaucoma Management","Diagnosis and management of glaucoma, including medications, laser therapy, and surgical interventions.","Quản lý bệnh tăng áp lực mắt","Chuẩn đoán và quản lý bệnh tăng áp lực mắt, bao gồm sử dụng thuốc, điều trị bằng tia laser và phẫu thuật.",No,2
12500,Ophthalmology,12504,"Retina and Macula Evaluation","Assessment and treatment of retinal and macular conditions, including age-related macular degeneration.","Đánh giá võng mạc và võng điện","Đánh giá và điều trị các tình trạng về võng mạc và võng điện, bao gồm bệnh thoái hóa võng mạc liên quan đến tuổi tác.",No,2
12500,Ophthalmology,12505,"Corneal Disorders and Surgery","Treatment of corneal disorders and injuries, including corneal transplantation and refractive surgeries.","Phẫu thuật tình trạng giác mạc và dịch tác","Điều trị các bệnh tình trạng giác mạc và thương tổn, bao gồm ghép giác mạc và phẫu thuật chỉnh thị.",No,1
12500,Ophthalmology,12506,"Pediatric Eye Care","Eye care for children, including pediatric eye exams and treatment for amblyopia (lazy eye).","Chăm sóc mắt trẻ em","Chăm sóc mắt cho trẻ em, bao gồm kiểm tra mắt trẻ em và điều trị cho trường hợp mắt lười.",No,2
12500,Ophthalmology,12507,"LASIK and Refractive Surgery","Laser-assisted in-situ keratomileusis (LASIK) and other refractive surgeries to correct vision problems.","Phẫu thuật LASIK và phẫu thuật chỉnh thị","Phẫu thuật chỉnh thị bằng laser (LASIK) và các phẫu thuật chỉnh thị khác để sửa các vấn đề về thị lực.",No,1
12500,Ophthalmology,12508,"Eyelid Surgery","Surgical procedures to correct eyelid conditions and improve vision, such as blepharoplasty.","Phẫu thuật mí mắt","Các quy trình phẫu thuật để sửa các tình trạng mí mắt và cải thiện thị lực, chẳng hạn như phẫu thuật mí mắt.",No,2
12500,Ophthalmology,12509,"Contact Lens Fitting","Fitting and prescription of contact lenses, including specialized lenses for conditions like astigmatism.","Đo kính áp tròng","Đo kính áp tròng và viết đơn kính áp tròng, bao gồm kính áp tròng chuyên dụng cho các tình trạng như cận thị.",No,4
12500,Ophthalmology,12510,"Emergency Eye Care","Urgent care for eye injuries, infections, and sudden vision changes, available outside regular hours.","Chăm sóc mắt cấp cứu","Chăm sóc cấp cứu cho chấn thương mắt, nhiễm trùng và thay đổi thị lực đột ngột, có sẵn ngoài giờ làm việc thường xuyên.",No,2
12600,Urology,12601,"Prostate Health Evaluation","Evaluation of prostate health, including PSA testing and digital rectal exams.","Đánh giá sức khỏe tuyến tiền liệt","Đánh giá sức khỏe tuyến tiền liệt, bao gồm xét nghiệm PSA và kiểm tra hậu môn sống.",No,1
12600,Urology,12602,"Kidney Stone Treatment","Diagnosis and treatment of kidney stones, including lithotripsy and surgical stone removal.","Điều trị sỏi thận","Chuẩn đoán và điều trị sỏi thận, bao gồm nghiền sỏi bằng sóng xung điện và loại bỏ sỏi bằng phẫu thuật.",No,2
12600,Urology,12603,"Bladder Conditions and Incontinence","Treatment for bladder conditions, including urinary incontinence and overactive bladder.","Điều trị các tình trạng bàng quang và tiểu không kiểm soát","Điều trị các tình trạng bàng quang, bao gồm tiểu không kiểm soát và bàng quang hoạt động quá mức.",No,2
12600,Urology,12604,"Erectile Dysfunction Management","Diagnosis and management of erectile dysfunction, including medication and therapy options.","Quản lý rối loạn cương dương","Chuẩn đoán và quản lý rối loạn cương dương, bao gồm tùy chọn sử dụng thuốc và tư vấn.",No,1
12600,Urology,12605,"Female Urology","Specialized urological care for women, including pelvic floor disorders and urinary tract issues.","Urology phụ nữ","Dịch vụ y tế urologic chuyên biệt cho phụ nữ, bao gồm các vấn đề về sàn chậu và đường tiểu.",No,1
12600,Urology,12606,"Testicular Health and Cancer Evaluation","Evaluation of testicular health and assessment of testicular cancer risk.","Đánh giá sức khỏe tinh hoàn và nguy cơ ung thư tinh hoàn","Đánh giá tình trạng sức khỏe tinh hoàn và đánh giá nguy cơ mắc ung thư tinh hoàn.",No,1
12600,Urology,12607,"Pediatric Urology","Urological care for children, including congenital urological issues and bedwetting.","Urology trẻ em","Dịch vụ y tế urologic cho trẻ em, bao gồm các vấn đề urologic bẩm sinh và tiểu ra giường.",No,2
12600,Urology,12608,"Sexual Health and Fertility","Evaluation and management of sexual health and fertility issues, including male infertility.","Sức khỏe tình dục và khả năng sinh sản","Đánh giá và quản lý các vấn đề về sức khỏe tình dục và khả năng sinh sản, bao gồm vấn đề về tinh trùng yếu.",No,2
12600,Urology,12609,"Urologic Cancer Care","Diagnosis and treatment of urologic cancers, such as bladder, kidney, and prostate cancer.","Chăm sóc ung thư urologic","Chuẩn đoán và điều trị các loại ung thư urologic, chẳng hạn như ung thư bàng quang, ung thư thận và ung thư tuyến tiền liệt.",No,0
12600,Urology,12610,"Reconstructive Urology","Surgical and non-surgical solutions for urological reconstruction, including urethral and bladder reconstruction.","Phẫu thuật urologic nâng cấp","Các giải pháp phẫu thuật và không phẫu thuật cho việc nâng cấp urologic, bao gồm phục hồi niệu đạo và bàng quang.",No,0
12700,Cardiology,12701,"Cardiac Evaluation","Comprehensive evaluation of heart health, including EKG, stress tests, and echocardiography.","Đánh giá sức khỏe tim mạch","Đánh giá toàn diện về sức khỏe tim mạch, bao gồm EKG, thử nghiệm căng thẳng và siêu âm tim mạch.",No,3
12700,Cardiology,12702,"Coronary Artery Disease Management","Diagnosis and management of coronary artery disease, including medication and lifestyle changes.","Quản lý bệnh mạch vành","Chuẩn đoán và quản lý bệnh mạch vành, bao gồm sử dụng thuốc và thay đổi lối sống.",No,2
12700,Cardiology,12703,"Congestive Heart Failure Care","Comprehensive care for congestive heart failure patients, including medication and lifestyle recommendations.","Chăm sóc bệnh tim mạch mất khả năng","Chăm sóc toàn diện cho bệnh nhân mắc bệnh tim mạch mất khả năng, bao gồm sử dụng thuốc và khuyến nghị thay đổi lối sống.",No,2
12700,Cardiology,12704,"Hypertension Management","Diagnosis and management of high blood pressure (hypertension), including medication and lifestyle guidance.","Quản lý tăng huyết áp","Chuẩn đoán và quản lý tình trạng tăng huyết áp (tăng huyết áp), bao gồm sử dụng thuốc và hướng dẫn về lối sống.",No,4
12700,Cardiology,12705,"Arrhythmia Treatment","Diagnosis and treatment of heart arrhythmias, including medication, ablation, and pacemaker implantation.","Điều trị nhịp tim","Chuẩn đoán và điều trị các rối loạn nhịp tim, bao gồm sử dụng thuốc, phương pháp đốt và ghép máy đặt nhịp tim.",No,2
12700,Cardiology,12706,"Cardiac Rehabilitation","Rehabilitation programs for patients recovering from heart-related events or surgeries.","Phục hồi tim mạch","Các chương trình phục hồi cho bệnh nhân đang phục hồi sau các sự kiện hoặc phẫu thuật liên quan đến tim mạch.",No,2
12700,Cardiology,12707,"Preventive Cardiology","Preventive measures and risk assessment for heart disease, including lipid profiles and heart health advice.","Y học phòng ngừa tim mạch","Các biện pháp phòng ngừa và đánh giá nguy cơ mắc bệnh tim mạch, bao gồm kiểm tra lipid và lời khuyên về sức khỏe tim mạch.",No,2
12700,Cardiology,12708,"Cardiac Imaging","Imaging tests for heart conditions, including stress tests, echocardiograms, and cardiac MRI.","Hình ảnh tim mạch","Kiểm tra hình ảnh cho các tình trạng tim mạch, bao gồm các thử nghiệm căng thẳng, siêu âm tim mạch và MRI tim mạch.",No,2
12700,Cardiology,12709,"Pediatric Cardiology","Cardiac care for children, including congenital heart defects and pediatric heart conditions.","Tim mạch trẻ em","Chăm sóc tim mạch cho trẻ em, bao gồm bệnh tim mạch bẩm sinh và các tình trạng tim mạch trẻ em.",No,2
12700,Cardiology,12710,"Peripheral Vascular Disease Management","Diagnosis and management of peripheral vascular diseases, including artery and vein conditions.","Quản lý bệnh mạch máu ngoại biên","Chuẩn đoán và quản lý các bệnh mạch máu ngoại biên, bao gồm tình trạng động mạch và tĩnh mạch.",No,2
