specialty_id,specialty_name,service_id,service_name,service_desc,service_name_vn,service_desc_vn,is_advanced,intensity_level
11100,Neurosurgery,11101,"Initial Consultation for Neurological Symptoms","Evaluation of specific symptoms such as severe headaches or seizures, with diagnosis and treatment recommendations.","Tư vấn ban đầu về triệu chứng thần kinh","Đánh giá các triệu chứng cụ thể như đau đầu nghiêm trọng hoặc co giật, cung cấp đề xuất về chẩn đoán và điều trị.",No,2
11100,Neurosurgery,11102,"Brain Tumor Consultation","Evaluation for suspected brain tumors or cysts, with discussion of surgical treatment options and planning.","Tư vấn về u não","Đánh giá các nghi ngờ về u não hoặc áp xe, thảo luận về tùy chọn điều trị bằng phẫu thuật và lập kế hoạch.",No,2
11100,Neurosurgery,11103,"Spinal Surgery Evaluation","Consultation for spinal conditions such as herniated discs or spinal stenosis, with an assessment of the need for surgical intervention.","Đánh giá phẫu thuật cột sống","Tư vấn cho các vấn đề cột sống như đĩa đệm thoát vị hoặc co hẹp cột sống, đánh giá nhu cầu can thiệp phẫu thuật.",No,2
11100,Neurosurgery,11104,"Epilepsy Assessment","Diagnosis and evaluation for epilepsy or seizure disorders, with treatment recommendations, including surgery if needed.","Đánh giá động kinh","Chẩn đoán và đánh giá về bệnh động kinh hoặc rối loạn co giật, đưa ra đề xuất điều trị, bao gồm phẫu thuật nếu cần.",No,2
11100,Neurosurgery,11105,"Aneurysm Evaluation","Assessment and monitoring of cerebral aneurysms, with planning for endovascular or surgical intervention.","Đánh giá nứt động mạch sọ não","Đánh giá và theo dõi các nứt động mạch sọ não, lập kế hoạch cho can thiệp mạch máu bằng cách phẫu thuật hoặc thông qua mạch máu bên trong.",No,2
11100,Neurosurgery,11106,"Pediatric Neurosurgery Consultation","Evaluation of pediatric neurological conditions, with treatment planning for pediatric patients.","Tư vấn phẫu thuật não trẻ em","Đánh giá các vấn đề thần kinh trẻ em, lập kế hoạch điều trị cho bệnh nhân trẻ em.",Yes,0
11100,Neurosurgery,11107,"Spinal Cord Injury Management","Assessment and treatment of spinal cord injuries, including rehabilitation and surgical interventions.","Quản lý chấn thương cột sống","Đánh giá và điều trị chấn thương cột sống, bao gồm phục hồi và can thiệp phẫu thuật.",Yes,2
11100,Neurosurgery,11108,"Deep Brain Stimulation (DBS) Consultation","Evaluation for movement disorders, such as Parkinson's disease, with discussion of DBS as a treatment option.","Tư vấn kích thích não sâu","Đánh giá cho các rối loạn vận động như bệnh Parkinson, thảo luận về DBS như một tùy chọn điều trị.",Yes,0
11100,Neurosurgery,11109,"Chronic Pain Assessment","Evaluation for chronic pain syndromes, including neuropathic pain, with discussion of surgical and non-surgical pain management.","Đánh giá đau mạn tính","Đánh giá các hội chứng đau mạn tính, bao gồm đau thần kinh, thảo luận về quản lý đau phẫu thuật và không phẫu thuật.",Yes,0
11200,Palliative Care,11201,"Initial Consultation for Palliative Care","Evaluation and planning for pain and symptom management in patients with life-limiting illnesses.","Tư vấn ban đầu về chăm sóc giảm nhẹ","Đánh giá và lập kế hoạch quản lý đau và triệu chứng cho bệnh nhân mắc bệnh có giới hạn cuộc sống.",No,3
11200,Palliative Care,11202,"End-of-Life Planning","Assistance with end-of-life planning, including advanced care directives and family discussions.","Lập kế hoạch cuối đời","Hỗ trợ trong lập kế hoạch cuối đời, bao gồm chỉ đạo chăm sóc nâng cao và cuộc thảo luận gia đình.",No,3
11200,Palliative Care,11203,"Pain Management Services","Comprehensive pain management services, including medication adjustment and non-pharmacological approaches.","Dịch vụ quản lý đau","Dịch vụ quản lý đau toàn diện, bao gồm điều chỉnh thuốc và phương pháp không dùng thuốc.",No,3
11200,Palliative Care,11204,"Hospice Care Consultation","Consultation regarding hospice care options, including in-home or facility-based care.","Tư vấn chăm sóc hospice","Tư vấn về tùy chọn chăm sóc hospice, bao gồm chăm sóc tại nhà hoặc tại cơ sở chăm sóc.",No,3
11200,Palliative Care,11205,"Grief and Bereavement Support","Support for individuals and families experiencing grief and loss, including counseling and coping strategies.","Hỗ trợ tang thương và đau buồn","Hỗ trợ cho cá nhân và gia đình đang trải qua đau buồn và mất mát, bao gồm tư vấn và chiến lược đối phó.",No,3
11200,Palliative Care,11206,"Pediatric Palliative Care Consultation","Evaluation and planning for palliative care for children with life-limiting conditions.","Tư vấn chăm sóc giảm nhẹ trẻ em","Đánh giá và lập kế hoạch chăm sóc giảm nhẹ cho trẻ em mắc bệnh có giới hạn cuộc sống.",Yes,3
11200,Palliative Care,11207,"Family Caregiver Support","Support and education for family caregivers providing care to patients with life-limiting illnesses.","Hỗ trợ người chăm sóc gia đình","Hỗ trợ và giáo dục cho người chăm sóc gia đình đang chăm sóc bệnh nhân mắc bệnh có giới hạn cuộc sống.",No,3
11200,Palliative Care,11208,"Advanced Care Directives","Assistance in preparing advanced care directives, living wills, and durable power of attorney for healthcare decisions.","Chỉ đạo chăm sóc nâng cao","Hỗ trợ trong việc chuẩn bị chỉ đạo chăm sóc nâng cao, di chúc sống và quyền ủy quyền về quyết định chăm sóc sức khỏe bền vững.",No,3
11200,Palliative Care,11209,"Symptom Assessment and Management","Regular assessment and management of symptoms, including pain, nausea, and shortness of breath, to improve patient comfort.","Đánh giá và quản lý triệu chứng","Đánh giá định kỳ và quản lý các triệu chứng, bao gồm đau đớn, buồn nôn và khó thở, nhằm cải thiện sự thoải mái của bệnh nhân.",No,3
11200,Palliative Care,11210,"Holistic Well-being Planning","Comprehensive planning for the overall well-being of patients, addressing physical, emotional, and spiritual needs.","Lập kế hoạch cho sức khỏe toàn diện","Lập kế hoạch toàn diện cho sức khỏe tổng thể của bệnh nhân, bao gồm các nhu cầu về thể chất, tinh thần và tâm linh.",No,3
11300,Neurology,11301,"General Neurological Consultation","Comprehensive evaluation and consultation for neurological issues, including diagnosis and treatment recommendations.","Tư vấn nội thần kinh tổng quát","Đánh giá toàn diện và tư vấn về các vấn đề nội thần kinh, bao gồm chẩn đoán và đề xuất điều trị.",No,3
11300,Neurology,11302,"Epilepsy Management","Specialized care and management for individuals with epilepsy, including medication management and lifestyle recommendations.","Quản lý động kinh","Chăm sóc chuyên sâu và quản lý cho người mắc bệnh động kinh, bao gồm quản lý thuốc và đề xuất lối sống.",No,2
11300,Neurology,11303,"Headache and Migraine Management","Evaluation and management of headaches and migraines, including diagnosis, treatment, and preventive strategies.","Quản lý đau đầu và chứng đau nửa đầu","Đánh giá và quản lý đau đầu và chứng đau nửa đầu, bao gồm chẩn đoán, điều trị và chiến lược phòng ngừa.",No,2
11300,Neurology,11304,"Stroke Evaluation and Treatment","Rapid evaluation and intervention for stroke patients to minimize damage and optimize recovery.","Đánh giá và điều trị đột quỵ","Đánh giá và can thiệp nhanh chóng cho bệnh nhân mắc bệnh đột quỵ để giảm thiểu thiệt hại và tối ưu hóa phục hồi.",No,2
11300,Neurology,11305,"Neuropathy Management","Management of neuropathic conditions, addressing pain and discomfort associated with nerve damage.","Quản lý bệnh thần kinh ngoại biên","Quản lý các tình trạng thần kinh ngoại biên, giải quyết đau và khó chịu liên quan đến hỏng hóc thần kinh.",No,2
11300,Neurology,11306,"Movement Disorders","Diagnosis and management of movement disorders, including Parkinson's disease and essential tremor.","Chẩn đoán và quản lý rối loạn vận động","Chẩn đoán và quản lý các rối loạn vận động, bao gồm bệnh Parkinson và rung tay cơ bản.",No,2
11300,Neurology,11307,"Memory and Cognitive Assessment","Assessment of memory and cognitive function to diagnose and manage conditions like dementia and Alzheimer's disease.","Đánh giá trí nhớ và chức năng nhận thức","Đánh giá trí nhớ và chức năng nhận thức để chẩn đoán và quản lý các tình trạng như mất trí nhớ và bệnh Alzheimer.",No,3
11300,Neurology,11308,"Pediatric Neurology Consultation","Consultation and evaluation for neurological issues in children, including developmental delays and seizures.","Tư vấn nội thần kinh trẻ em","Tư vấn và đánh giá về các vấn đề nội thần kinh ở trẻ em, bao gồm trễ phát triển và cơn động kinh.",No,2
11300,Neurology,11309,"Neurological Testing and Imaging","Diagnostic testing and imaging, such as EEG, MRI, and CT scans, to assess neurological conditions.","Kiểm tra và hình ảnh nội thần kinh","Kiểm tra chẩn đoán và hình ảnh, chẳng hạn như EEG, MRI và CT scan, để đánh giá các tình trạng nội thần kinh.",No,2
11300,Neurology,11310,"Neurorehabilitation Services","Rehabilitation programs for patients with neurological conditions to regain function and improve quality of life.","Dịch vụ phục hồi nội thần kinh","Các chương trình phục hồi cho bệnh nhân mắc các tình trạng nội thần kinh để lấy lại chức năng và cải thiện chất lượng cuộc sống.",No,2
11400,Dermatology,11401,"Skin Examination and Diagnosis","Comprehensive skin examination and diagnosis of dermatological conditions, including rashes, moles, and skin lesions.","Kiểm tra da và chẩn đoán","Kiểm tra da toàn diện và chẩn đoán các tình trạng ngoại da, bao gồm các bệnh nổi mề đay, nốt ruồi và tổn thương da.",No,3
11400,Dermatology,11402,"Acne Treatment","Treatment plans for acne, including topical and oral medications, as well as skincare recommendations.","Điều trị mụn trứng cá","Kế hoạch điều trị mụn trứng cá, bao gồm thuốc sử dụng ngoài da và uống cũng như đề xuất chăm sóc da.",No,4
11400,Dermatology,11403,"Eczema Management","Management of eczema and related skin conditions, including itching and inflammation control.","Quản lý chàm","Quản lý chàm và các tình trạng da liên quan, bao gồm kiểm soát ngứa và viêm.",No,4
11400,Dermatology,11404,"Skin Cancer Screening","Screening and early detection of skin cancer, with recommendations for treatment and prevention.","Kiểm tra ung thư da","Kiểm tra và phát hiện sớm ung thư da, với đề xuất về điều trị và phòng ngừa.",No,2
11400,Dermatology,11405,"Psoriasis Treatment","Comprehensive treatment for psoriasis, including topical medications and phototherapy options.","Điều trị bệnh vẩy nến","Điều trị toàn diện cho bệnh vẩy nến, bao gồm các loại thuốc sử dụng ngoài da và tùy chọn xạ trị ánh sáng.",No,4
11400,Dermatology,11406,"Cosmetic Dermatology Services","Cosmetic dermatology services, including botox, fillers, and laser treatments for skin rejuvenation.","Dịch vụ thẩm mỹ da","Dịch vụ thẩm mỹ da, bao gồm botox, chất độn và điều trị bằng tia laser để làm trẻ hóa da.",No,4
11400,Dermatology,11407,"Hair and Scalp Evaluation","Evaluation and treatment for hair and scalp conditions, including hair loss and scalp disorders.","Đánh giá tóc và da đầu","Đánh giá và điều trị cho các tình trạng tóc và da đầu, bao gồm rụng tóc và các rối loạn da đầu.",No,4
11400,Dermatology,11408,"Pediatric Dermatology Consultation","Consultation and evaluation for dermatological issues in children, including pediatric skin conditions.","Tư vấn da liễu trẻ em","Tư vấn và đánh giá về các vấn đề da liễu ở trẻ em, bao gồm các tình trạng da liễu trẻ em.",No,4
11400,Dermatology,11409,"Wound Care and Scar Management","Treatment and management of wounds and scars to promote healing and minimize scarring.","Chăm sóc vết thương và quản lý sẹo","Điều trị và quản lý vết thương và sẹo để thúc đẩy làm lành và giảm thiểu vết sẹo.",No,4
11400,Dermatology,11410,"Dermatological Procedures","Dermatological procedures such as biopsies, cryotherapy, and excisions for diagnosis and treatment.","Các thủ thuật da liễu","Các thủ thuật da liễu như nội soi, tuyết đông học và loại bỏ vùng da để chẩn đoán và điều trị.",No,4
11500,Allergy and Immunology,11501,"Allergy Testing","Comprehensive allergy testing to identify allergens, including skin prick tests and blood tests.","Kiểm tra dị ứng","Kiểm tra dị ứng toàn diện để xác định chất gây dị ứng, bao gồm kiểm tra đốt da và kiểm tra máu.",No,3
11500,Allergy and Immunology,11502,"Asthma Management","Diagnosis and management of asthma, including personalized treatment plans and inhaler instructions.","Quản lý hen suyễn","Chẩn đoán và quản lý hen suyễn, bao gồm kế hoạch điều trị cá nhân hóa và hướng dẫn sử dụng hít thuốc.",No,3
11500,Allergy and Immunology,11503,"Immunization Consultation","Consultation regarding vaccinations and immunizations, including vaccine schedules and recommendations.","Tư vấn tiêm chủng","Tư vấn về tiêm chủng và miễn dịch, bao gồm lịch tiêm chủng và đề xuất.",No,3
11500,Allergy and Immunology,11504,"Food Allergy Management","Management of food allergies, including dietary advice and emergency plans for anaphylaxis.","Quản lý dị ứng thực phẩm","Quản lý dị ứng thực phẩm, bao gồm lời khuyên dinh dưỡng và kế hoạch cấp cứu cho hiện tượng phản vệ tinh mạch.",No,2
11500,Allergy and Immunology,11505,"Rhinitis and Sinusitis Treatment","Treatment for allergic rhinitis and sinusitis, including medication and nasal spray options.","Điều trị viêm mũi dị ứng và viêm xoang","Điều trị viêm mũi dị ứng và viêm xoang, bao gồm thuốc và tùy chọn xịt mũi.",No,3
11500,Allergy and Immunology,11506,"Drug Allergy Evaluation","Evaluation of drug allergies, including skin testing and desensitization procedures.","Đánh giá dị ứng thuốc","Đánh giá về dị ứng thuốc, bao gồm kiểm tra đốt da và quy trình giảm nhạy thuốc.",No,3
11500,Allergy and Immunology,11507,"Immunodeficiency Evaluation","Evaluation and diagnosis of immunodeficiency disorders, with treatment recommendations.","Đánh giá suy miễn dịch","Đánh giá và chẩn đoán các rối loạn suy miễn dịch, với đề xuất điều trị.",No,3
11500,Allergy and Immunology,11508,"Insect Allergy Testing","Testing and diagnosis of insect allergies, including bees, wasps, and ants.","Kiểm tra dị ứng côn trùng","Kiểm tra và chẩn đoán dị ứng côn trùng, bao gồm ong, bò sát và kiến.",No,3
11500,Allergy and Immunology,11509,"Travel Immunizations","Immunizations and travel health advice for individuals planning international travel.","Tiêm chủng du lịch","Tiêm chủng và lời khuyên về sức khỏe du lịch cho những người có kế hoạch đi du lịch quốc tế.",No,3
11500,Allergy and Immunology,11510,"Allergen Avoidance Strategies","Strategies for avoiding allergens in daily life, including allergen-free living recommendations.","Chiến lược tránh dị ứng","Chiến lược để tránh dị ứng trong cuộc sống hàng ngày, bao gồm đề xuất sống không có dị ứng.",No,3
11600,Interventional Radiology,11601,"Diagnostic Angiography","Angiography to diagnose vascular conditions and guide treatment decisions.","X-quang mạch máu chẩn đoán","X-quang mạch máu để chẩn đoán các tình trạng mạch máu và hướng dẫn quyết định điều trị.",No,2
11600,Interventional Radiology,11602,"Minimally Invasive Procedures","Minimally invasive interventional procedures, such as angioplasty and stent placement.","Các thủ thuật ít xâm lấn","Các thủ thuật can thiệp ít xâm lấn, chẳng hạn như nở mạch và đặt stent.",No,3
11600,Interventional Radiology,11603,"Tumor Embolization","Embolization procedures to treat tumors by blocking blood flow to the tumor site.","Thủ thuật tắc mạch u nang","Các thủ thuật tắc mạch để điều trị u nang bằng cách chặn dòng máu tới nơi u nang.",No,2
11600,Interventional Radiology,11604,"Vascular Stent Placement","Placement of vascular stents to treat narrowed or blocked blood vessels.","Đặt stent mạch máu","Đặt stent mạch máu để điều trị các mạch máu bị co lại hoặc bị tắc nghẽn.",No,2
11600,Interventional Radiology,11605,"Varicose Vein Treatment","Treatment of varicose veins through minimally invasive procedures and sclerotherapy.","Điều trị tĩnh mạch biến dạng","Điều trị tĩnh mạch biến dạng thông qua các thủ thuật ít xâm lấn và quá trình tiêm thuốc làm cứng tĩnh mạch.",No,2
11600,Interventional Radiology,11606,"Biopsy Procedures","Minimally invasive biopsy procedures for tissue sample collection and diagnosis.","Các thủ thuật nội soi","Các thủ thuật nội soi ít xâm lấn để thu thập mẫu mô và chẩn đoán.",No,2
11600,Interventional Radiology,11607,"Uterine Fibroid Embolization","Embolization to treat uterine fibroids by blocking their blood supply, reducing symptoms.","Tắc mạch u tử cung","Tắc mạch để điều trị u tử cung bằng cách chặn nguồn máu, giảm triệu chứng.",No,2
11600,Interventional Radiology,11608,"Central Venous Access Placement","Placement of central venous catheters for medication administration and blood draws.","Đặt ống trung tâm qua mạch máu","Đặt ống trung tâm qua mạch máu để tiêm thuốc và rút máu.",No,2
11600,Interventional Radiology,11609,"Biliary Drainage Procedures","Interventions for biliary drainage in cases of obstructed bile ducts and related issues.","Các thủ thuật dẫn mật","Can thiệp dẫn mật trong trường hợp ống mật bị tắc và các vấn đề liên quan.",No,2
11600,Interventional Radiology,11610,"Peripheral Artery Disease Management","Management of peripheral artery disease through endovascular procedures and stent placement.","Quản lý bệnh mạch ngoại biên","Quản lý bệnh mạch ngoại biên thông qua các thủ thuật nội soi và đặt stent.",No,2
11700,Proctology,11701,"Hemorrhoid Treatment","Treatment for hemorrhoids, including minimally invasive procedures and lifestyle recommendations.","Điều trị trĩ","Điều trị trĩ, bao gồm các thủ thuật ít xâm lấn và đề xuất lối sống.",No,3
11700,Proctology,11702,"Anal Fissure Management","Management of anal fissures, including dietary advice and topical treatments.","Quản lý rạn nứt hậu môn","Quản lý rạn nứt hậu môn, bao gồm lời khuyên dinh dưỡng và các biện pháp điều trị ngoài da.",No,2
11700,Proctology,11703,"Pilonidal Cyst Treatment","Treatment of pilonidal cysts, including drainage procedures and surgical removal.","Điều trị u nang nách","Điều trị u nang nách, bao gồm các thủ thuật thủ tiêm và loại bỏ phẫu thuật.",No,2
11700,Proctology,11704,"Anorectal Abscess Care","Care for anorectal abscesses, including incision and drainage as necessary.","Chăm sóc ác quản hậu môn","Chăm sóc ác quản hậu môn, bao gồm việc mở và dẫn nước cần thiết.",No,2
11700,Proctology,11705,"Rectal Polyp Removal","Removal of rectal polyps through endoscopy or surgical procedures as needed.","Loại bỏ polyp hậu môn","Loại bỏ polyp hậu môn thông qua nội soi hoặc phẫu thuật khi cần.",No,2
11700,Proctology,11706,"Anal Cancer Screening","Screening for anal cancer, including anal Pap tests and imaging when indicated.","Kiểm tra ung thư hậu môn","Kiểm tra ung thư hậu môn, bao gồm xét nghiệm Pap hậu môn và hình ảnh khi cần thiết.",No,2
11700,Proctology,11707,"Anal Fistula Management","Management of anal fistulas, including surgical repair and ongoing care.","Quản lý túi mở hậu môn","Quản lý túi mở hậu môn, bao gồm phẫu thuật sửa chữa và chăm sóc liên tục.",No,2
11700,Proctology,11708,"Rectal Bleeding Evaluation","Evaluation and diagnosis of rectal bleeding causes, with appropriate treatment recommendations.","Đánh giá chảy máu hậu môn","Đánh giá và chẩn đoán nguyên nhân gây chảy máu hậu môn, với đề xuất điều trị phù hợp.",No,3
11700,Proctology,11709,"Anal Wart Treatment","Treatment for anal warts, including topical treatments and wart removal procedures.","Điều trị mụn cào hậu môn","Điều trị mụn cào hậu môn, bao gồm các phương pháp điều trị ngoài da và loại bỏ mụn cào.",No,3
11700,Proctology,11710,"Fecal Incontinence Management","Management of fecal incontinence with personalized care plans and therapies.","Quản lý không kiểm soát phân","Quản lý không kiểm soát phân với kế hoạch chăm sóc và liệu pháp cá nhân hóa.",No,2
11800,Pulmonology,11801,"Asthma Diagnosis and Management","Diagnosis and management of asthma, including lung function tests and inhaler guidance.","Chẩn đoán và quản lý hen suyễn","Chẩn đoán và quản lý hen suyễn, bao gồm xét nghiệm chức năng phổi và hướng dẫn sử dụng hít thuốc.",No,3
11800,Pulmonology,11802,"Chronic Obstructive Pulmonary Disease (COPD) Care","Comprehensive care and treatment for COPD, including inhaler instructions and oxygen therapy.","Quản lý bệnh mạch phổi tắc nghẽn mãn tính (COPD)","Quản lý bệnh mạch phổi tắc nghẽn mãn tính (COPD) toàn diện và điều trị, bao gồm hướng dẫn sử dụng hít thuốc và oxy hóa.",No,2
11800,Pulmonology,11803,"Lung Cancer Screening","Screening for lung cancer, including low-dose CT scans and risk assessment.","Kiểm tra ung thư phổi","Kiểm tra ung thư phổi, bao gồm siêu âm CT liều thấp và đánh giá rủi ro.",No,2
11800,Pulmonology,11804,"Sleep Disorders Diagnosis","Diagnosis and evaluation of sleep disorders, such as sleep apnea, with sleep studies.","Chẩn đoán rối loạn ngủ","Chẩn đoán và đánh giá rối loạn ngủ, chẳng hạn như ngưng thở trong giấc ngủ, bằng các nghiên cứu về giấc ngủ.",No,4
11800,Pulmonology,11805,"Pulmonary Function Testing","Lung function testing to assess breathing capacity and identify lung conditions.","Kiểm tra chức năng phổi","Kiểm tra chức năng phổi để đánh giá khả năng hô hấp và xác định các bệnh phổi.",No,3
11800,Pulmonology,11806,"Smoking Cessation Support","Support and programs to help individuals quit smoking and improve lung health.","Hỗ trợ cai thuốc lá","Hỗ trợ và chương trình để giúp người cai thuốc lá và cải thiện sức khỏe phổi.",No,4
11800,Pulmonology,11807,"Pulmonary Rehabilitation","Rehabilitation programs for individuals with chronic lung conditions to improve lung function.","Phục hồi chức năng phổi","Chương trình phục hồi chức năng phổi cho những người có bệnh phổi mãn tính để cải thiện chức năng phổi.",No,3
11800,Pulmonology,11808,"Cystic Fibrosis Management","Comprehensive care for individuals with cystic fibrosis, including airway clearance techniques.","Quản lý nắng bệnh xơ phổi","Chăm sóc toàn diện cho người có bệnh xơ phổi, bao gồm kỹ thuật làm sạch đường hô hấp.",No,2
11800,Pulmonology,11809,"Bronchoscopy Procedures","Diagnostic and therapeutic bronchoscopy procedures to evaluate and treat lung issues.","Các thủ thuật nội soi phế quản","Các thủ thuật nội soi chẩn đoán và điều trị để đánh giá và điều trị vấn đề phổi.",No,2
11800,Pulmonology,11810,"Lung Infection Treatment","Treatment for lung infections, including antibiotic therapy and chest physiotherapy.","Điều trị nhiễm trùng phổi","Điều trị nhiễm trùng phổi, bao gồm liệu pháp kháng sinh và vận động thực hiện hô hấp.",No,2
11900,Medical Oncology,11901,"Cancer Diagnosis and Staging","Diagnosis of cancer types and staging to determine the extent and treatment plan.","Chẩn đoán và đánh giá mức độ ung thư","Chẩn đoán các loại ung thư và đánh giá mức độ để xác định phác đồ điều trị.",No,2
