specialty_id,specialty_name,service_id,service_name,service_desc,service_name_vn,service_desc_vn,is_advanced,intensity_level
12700,Cardiology,12711,"Heart Attack Management","Immediate care and long-term management for patients who have experienced a heart attack.","Quản lý cơn đau tim","Chăm sóc ngay lập tức và quản lý dài hạn cho bệnh nhân đã trải qua cơn đau tim.",No,2
12700,Cardiology,12712,"Cardiac Medication Adjustment","Adjustment and optimization of cardiac medications to manage heart conditions.","Điều chỉnh thuốc tim mạch","Điều chỉnh và tối ưu hóa các loại thuốc tim mạch để quản lý tình trạng tim mạch.",No,1
12700,Cardiology,12713,"Heart Valve Conditions","Diagnosis and treatment of heart valve conditions, including stenosis and regurgitation.","Vấn đề van tim","Chuẩn đoán và điều trị các tình trạng van tim, bao gồm tắc nghẽn và trào ngược.",No,1
12700,Cardiology,12714,"Vascular Ultrasound","Non-invasive ultrasound imaging of blood vessels to assess vascular health.","Siêu âm mạch máu","Hình ảnh siêu âm không xâm lấn của các mạch máu để đánh giá sức khỏe mạch máu.",No,1
12700,Cardiology,12715,"Atherosclerosis Management","Management and prevention strategies for atherosclerosis and arterial plaque buildup.","Quản lý xơ vữa mạch máu","Chiến lược quản lý và phòng ngừa xơ vữa mạch máu và tích tụ bám động mạch.",No,1
12700,Cardiology,12716,"Congenital Heart Disease Care","Specialized care for patients with congenital heart defects and anomalies.","Chăm sóc bệnh tim mạch bẩm sinh","Chăm sóc chuyên biệt cho bệnh nhân mắc bệnh tim mạch bẩm sinh và các biến thể.",No,2
12700,Cardiology,12717,"Heart Rhythm Disorders","Diagnosis and treatment of heart rhythm disorders, including atrial fibrillation and bradycardia.","Rối loạn nhịp tim","Chuẩn đoán và điều trị rối loạn nhịp tim, bao gồm nhĩ đập và nhịp tim chậm.",No,2
12700,Cardiology,12718,"Electrocardiogram (ECG) Testing","Diagnostic testing using electrocardiograms (ECGs) to assess heart electrical activity.","Kiểm tra điện tim (ECG)","Kiểm tra chẩn đoán bằng cách sử dụng điện tim (ECG) để đánh giá hoạt động điện của tim.",No,2
12700,Cardiology,12719,"High Cholesterol Management","Diagnosis and management of high cholesterol levels to reduce heart disease risk.","Quản lý cholesterol cao","Chuẩn đoán và quản lý mức cholesterol cao để giảm nguy cơ mắc bệnh tim mạch.",No,2
12700,Cardiology,12720,"Cardiovascular Risk Assessment","Assessment of cardiovascular risk factors and personalized prevention plans.","Đánh giá nguy cơ tim mạch","Đánh giá các yếu tố nguy cơ tim mạch và lập kế hoạch phòng ngừa cá nhân hóa.",No,2
12700,Cardiology,12721,"Hypertrophic Cardiomyopathy Care","Specialized care for hypertrophic cardiomyopathy, a genetic heart condition.","Chăm sóc bệnh tim mạch toàn rỡ","Chăm sóc chuyên biệt cho bệnh tim mạch toàn rỡ, một tình trạng tim mạch di truyền.",No,2
12700,Cardiology,12722,"Endovascular Surgery","Minimally invasive surgical procedures for treating vascular and cardiac conditions.","Phẫu thuật mạch máu nội tiết","Các thủ thuật phẫu thuật can thiệp tối thiểu để điều trị các tình trạng mạch máu và tim mạch.",Yes,1
12700,Cardiology,12723,"Cardiac Catheterization","Diagnostic procedure using catheters to visualize the heart's blood vessels and chambers.","Kiểm tra mạch tim","Thủ tục chẩn đoán sử dụng ống nội soi để quan sát các mạch máu và buồng tim của tim.",Yes,2
12800,Pediatrics,12801,"Well-Baby Checkup","Regular health checkups for infants and young children to monitor growth and development.","Kiểm tra sức khỏe cho trẻ sơ sinh","Kiểm tra sức khỏe đều đặn cho trẻ sơ sinh và trẻ nhỏ để theo dõi sự phát triển và tăng trưởng.",No,3
12800,Pediatrics,12802,"Childhood Immunizations","Administering vaccinations to protect children from various diseases and illnesses.","Tiêm chủng cho trẻ em","Tiêm chủng để bảo vệ trẻ em khỏi nhiều loại bệnh và bệnh tật khác nhau.",No,3
12800,Pediatrics,12803,"Pediatric Growth Evaluation","Assessment of a child's physical growth, including height, weight, and body mass index.","Đánh giá tăng trưởng trẻ em","Đánh giá tăng trưởng về mặt thể chất của trẻ, bao gồm chiều cao, cân nặng và chỉ số khối lượng cơ thể.",No,4
12800,Pediatrics,12804,"Common Childhood Illness Care","Diagnosis and treatment of common childhood illnesses, such as colds, ear infections, and fevers.","Chăm sóc bệnh thông thường ở trẻ em","Chuẩn đoán và điều trị các bệnh thông thường ở trẻ em, như cảm lạnh, nhiễm trùng tai và sốt.",No,4
12800,Pediatrics,12805,"Developmental Pediatrics","Evaluation and support for children with developmental delays or disabilities.","Khoa trẻ phát triển","Đánh giá và hỗ trợ cho trẻ em có sự trễ phát triển hoặc khuyết tật.",No,4
12800,Pediatrics,12806,"Pediatric Nutrition Counseling","Nutritional guidance and counseling for parents and children to promote healthy eating habits.","Tư vấn dinh dưỡng cho trẻ em","Hướng dẫn dinh dưỡng và tư vấn cho bố mẹ và trẻ em để khuyến khích thói quen ăn uống lành mạnh.",No,4
12800,Pediatrics,12807,"Pediatric Allergy Care","Diagnosis and treatment of allergies in children, including allergic reactions and asthma.","Chăm sóc dị ứng ở trẻ em","Chuẩn đoán và điều trị dị ứng ở trẻ em, bao gồm các phản ứng dị ứng và hen suyễn.",No,4
12800,Pediatrics,12808,"Pediatric Diabetes Management","Management and care for children with diabetes, including insulin therapy and monitoring.","Quản lý bệnh tiểu đường ở trẻ em","Quản lý và chăm sóc cho trẻ em mắc bệnh tiểu đường, bao gồm điều trị insulin và theo dõi.",No,2
12800,Pediatrics,12809,"Child Behavioral Counseling","Counseling and guidance for parents and children to address behavioral and emotional challenges.","Tư vấn hành vi trẻ em","Tư vấn và hướng dẫn cho bố mẹ và trẻ em để giải quyết các thách thức về hành vi và tâm lý.",No,4
12800,Pediatrics,12810,"Adolescent Health Assessment","Comprehensive health assessment for adolescents, including screenings, vaccinations, and counseling.","Đánh giá sức khỏe thanh thiếu niên","Đánh giá sức khỏe toàn diện cho thanh thiếu niên, bao gồm kiểm tra, tiêm chủng và tư vấn.",No,4
12800,Pediatrics,12811,"Pediatric Cardiology","Specialized care for children with heart conditions and congenital heart defects.","Tim mạch trẻ em","Chăm sóc chuyên biệt cho trẻ em mắc các tình trạng tim mạch và bệnh tim mạch bẩm sinh.",No,2
12800,Pediatrics,12812,"Pediatric Pulmonology","Diagnosis and treatment of respiratory conditions in children, including asthma and lung infections.","Hô hấp trẻ em","Chuẩn đoán và điều trị các tình trạng hô hấp ở trẻ em, bao gồm hen suyễn và nhiễm trùng phổi.",No,2
12800,Pediatrics,12813,"Pediatric Gastroenterology","Care for gastrointestinal issues in children, including reflux, constipation, and celiac disease.","Tiêu hóa trẻ em","Chăm sóc cho các vấn đề về tiêu hóa ở trẻ em, bao gồm trào ngược, táo bón và bệnh celiac.",No,2
12800,Pediatrics,12814,"Pediatric Neurology","Diagnosis and care for children with neurological conditions, such as seizures and developmental delays.","Thần kinh trẻ em","Chuẩn đoán và chăm sóc cho trẻ em mắc các tình trạng thần kinh, như động kinh và trễ phát triển.",No,2
12800,Pediatrics,12815,"Pediatric Orthopedics","Orthopedic care for children with musculoskeletal conditions, injuries, and orthopedic disorders.","Nội cơ xương trẻ em","Chăm sóc cơ xương cho trẻ em mắc các vấn đề về cơ xương, chấn thương và rối loạn cơ xương.",No,2
12800,Pediatrics,12816,"Pediatric Dermatology","Diagnosis and treatment of skin conditions and disorders in children, including eczema and warts.","Da liễu trẻ em","Chuẩn đoán và điều trị các vấn đề về da và các rối loạn da ở trẻ em, bao gồm chàm và mụn cóc.",No,2
12900,Orthopedic,12901,"Fracture Evaluation","Diagnosis and treatment of bone fractures, including X-rays and casting.","Chẩn đoán và điều trị gãy xương","Chuẩn đoán và điều trị gãy xương, bao gồm chụp X-quang và đúc bó bột.",No,2
12900,Orthopedic,12902,"Arthritis Management","Management and treatment of various types of arthritis, including osteoarthritis and rheumatoid arthritis.","Quản lý bệnh viêm khớp","Quản lý và điều trị nhiều loại bệnh viêm khớp, bao gồm viêm khớp xương và viêm khớp dạng thấp.",No,2
12900,Orthopedic,12903,"Spine and Back Care","Specialized care for spine and back conditions, including herniated discs and scoliosis.","Chăm sóc cột sống và lưng","Chăm sóc chuyên biệt cho các tình trạng cột sống và lưng, bao gồm đĩa đệm thoát vị và cong lưng.",No,2
12900,Orthopedic,12904,"Sports Injury Rehabilitation","Rehabilitation and physical therapy for sports-related injuries and musculoskeletal problems.","Phục hồi sau chấn thương thể thao","Phục hồi và liệu pháp vật lý cho chấn thương liên quan đến thể thao và các vấn đề về cơ xương.",No,2
12900,Orthopedic,12905,"Joint Replacement Surgery","Surgical procedures for joint replacement, including knee and hip replacements.","Phẫu thuật thay khớp","Các thủ thuật phẫu thuật để thay thế các khớp, bao gồm khớp đầu gối và hông.",No,1
12900,Orthopedic,12906,"Orthopedic Trauma Care","Emergency care and surgery for orthopedic trauma injuries, such as fractures and dislocations.","Chăm sóc chấn thương cơ xương","Chăm sóc cấp cứu và phẫu thuật cho chấn thương cơ xương, như gãy xương và trật khớp.",No,2
12900,Orthopedic,12907,"Pediatric Orthopedics","Orthopedic care for children with musculoskeletal conditions and injuries.","Nội cơ xương trẻ em","Chăm sóc cơ xương cho trẻ em mắc các vấn đề về cơ xương và chấn thương.",No,1
12900,Orthopedic,12908,"Orthopedic Oncology","Diagnosis and treatment of bone and soft tissue tumors and cancers in the musculoskeletal system.","Ung thư cơ xương","Chuẩn đoán và điều trị các khối u và ung thư xương và mô mềm trong hệ thống cơ xương.",Yes,0
13100,Nephrology,13101,"Kidney Function Evaluation","Assessment of kidney function, including blood tests and urine analysis.","Đánh giá chức năng thận","Đánh giá chức năng thận, bao gồm xét nghiệm máu và phân tích nước tiểu.",No,3
13100,Nephrology,13102,"Chronic Kidney Disease Management","Management and treatment of chronic kidney disease, including lifestyle changes and medications.","Quản lý bệnh thận mãn tính","Quản lý và điều trị bệnh thận mãn tính, bao gồm thay đổi lối sống và dùng thuốc.",No,2
13100,Nephrology,13103,"Hypertension and Kidney Health","Diagnosis and care for high blood pressure (hypertension) and its impact on kidney health.","Huyết áp cao và sức khỏe thận","Chuẩn đoán và chăm sóc cho tình trạng huyết áp cao (cao huyết áp) và tác động của nó đối với sức khỏe thận.",No,3
13100,Nephrology,13104,"Kidney Stones Treatment","Diagnosis and treatment of kidney stones, including stone removal and prevention strategies.","Điều trị sỏi thận","Chuẩn đoán và điều trị sỏi thận, bao gồm loại bỏ sỏi và chiến lược ngăn ngừa.",No,3
13100,Nephrology,13105,"Dialysis Services","Hemodialysis and peritoneal dialysis services for patients with kidney failure.","Dịch vụ thải độc thận","Dịch vụ thải độc bằng cách tiêm máu và thải độc bằng màng bụng cho bệnh nhân mắc bệnh thận.",No,0
13100,Nephrology,13106,"Kidney Transplant Evaluation","Assessment and evaluation for kidney transplantation, including donor matching.","Đánh giá ghép thận","Đánh giá và đánh giá cho việc ghép thận, bao gồm việc kết hợp nguồn cung cấp.",No,1
13100,Nephrology,13107,"Pediatric Nephrology","Specialized care for children with kidney and urinary tract conditions.","Nội thận trẻ em","Chăm sóc chuyên biệt cho trẻ em mắc các tình trạng về thận và đường tiết niệu.",No,2
13100,Nephrology,13108,"Nephrology Oncology","Diagnosis and treatment of kidney and urinary system cancers and tumors.","Ung thư thận","Chuẩn đoán và điều trị các bệnh ung thư và khối u trong hệ thống thận và tiết niệu.",Yes,1
13100,Nephrology,13109,"Acute Kidney Injury Treatment","Diagnosis and treatment of sudden kidney function decline (acute kidney injury).","Điều trị thận đột ngộp","Chuẩn đoán và điều trị sự giảm chức năng thận đột ngộp (thận đột ngộp).",No,1
13100,Nephrology,13110,"Pediatric Kidney Care","Specialized care for children with kidney and urinary tract conditions and diseases.","Chăm sóc thận trẻ em","Chăm sóc chuyên biệt cho trẻ em mắc các tình trạng về thận và đường tiết niệu.",No,2
13100,Nephrology,13111,"Hereditary Kidney Disorders","Diagnosis and management of hereditary kidney disorders and genetic kidney diseases.","Rối loạn thận di truyền","Chuẩn đoán và quản lý các rối loạn thận di truyền và bệnh thận di truyền.",No,1
13100,Nephrology,13112,"Peritoneal Dialysis Training","Training and education on peritoneal dialysis for patients and their caregivers.","Đào tạo thải độc bằng màng bụng","Đào tạo và giáo dục về thải độc bằng màng bụng cho bệnh nhân và người chăm sóc của họ.",No,1
13100,Nephrology,13113,"Kidney Disease Diet Counseling","Nutritional counseling and dietary guidance for patients with kidney disease.","Tư vấn dinh dưỡng cho bệnh thận","Tư vấn dinh dưỡng và hướng dẫn chế độ ăn uống cho bệnh nhân mắc bệnh thận.",No,3
13100,Nephrology,13114,"Living with Dialysis Support","Support services and guidance for individuals living with long-term dialysis treatment.","Hỗ trợ sống cùng thải độc","Dịch vụ hỗ trợ và hướng dẫn cho những người sống với điều trị thải độc dài hạn.",No,3
13200,Endocrinology,13201,"Diabetes Management","Comprehensive care for individuals with diabetes, including medication management and lifestyle counseling.","Quản lý bệnh tiểu đường","Chăm sóc toàn diện cho người mắc tiểu đường, bao gồm quản lý thuốc và tư vấn lối sống.",No,3
13200,Endocrinology,13202,"Thyroid Disorders Diagnosis","Diagnosis and treatment of thyroid disorders, including hypothyroidism and hyperthyroidism.","Chẩn đoán rối loạn tuyến giáp","Chuẩn đoán và điều trị các rối loạn tuyến giáp, bao gồm tuyến giáp hạn hán và tuyến giáp quá hoạt động.",No,2
13200,Endocrinology,13203,"Osteoporosis Management","Management and treatment of osteoporosis, including bone density testing and medication.","Quản lý bệnh loãng xương","Quản lý và điều trị bệnh loãng xương, bao gồm kiểm tra mật độ xương và thuốc.",No,3
13200,Endocrinology,13204,"Adrenal Disorders Care","Care for adrenal gland disorders, such as Addison's disease and Cushing's syndrome.","Chăm sóc rối loạn tuyến thượng thận","Chăm sóc cho các rối loạn tuyến thượng thận, như bệnh Addison và hội chứng Cushing.",No,2
13200,Endocrinology,13205,"Pituitary Gland Disorders","Diagnosis and treatment of disorders related to the pituitary gland, such as tumors and hormone imbalances.","Rối loạn tuyến yên","Chuẩn đoán và điều trị các rối loạn liên quan đến tuyến yên, như khối u và mất cân bằng hormone.",No,2
13200,Endocrinology,13206,"Polycystic Ovary Syndrome (PCOS) Management","Management of PCOS with a focus on hormonal balance and symptom relief.","Quản lý hội chứng buồn dầu nữ (PCOS)","Quản lý PCOS với tập trung vào cân bằng hormone và giảm triệu chứng.",No,2
13200,Endocrinology,13207,"Endocrine Hypertension Care","Diagnosis and care for hypertension related to endocrine disorders and hormone imbalances.","Chăm sóc huyết áp liên quan đến tuyến nội tiết","Chuẩn đoán và chăm sóc cho huyết áp liên quan đến rối loạn nội tiết và mất cân bằng hormone.",No,2
13300,Oral and Maxillofacial Surgery,13301,"Tooth Extraction","Surgical removal of teeth, including impacted wisdom teeth and other extractions.","Loại bỏ răng","Loại bỏ phẫu thuật của răng, bao gồm răng thông thường và các răng khôn bị nằm sâu và các răng khác.",No,4
13300,Oral and Maxillofacial Surgery,13302,"Orthognathic Surgery","Surgical correction of jaw and facial deformities for improved function and aesthetics.","Phẫu thuật chỉnh hình hàm mặt","Phẫu thuật sửa chữa các biến dạng hàm và khuôn mặt để cải thiện chức năng và vẻ đẹp.",No,3
13300,Oral and Maxillofacial Surgery,13303,"Dental Implants","Surgical placement of dental implants to replace missing teeth or support dentures.","Cấy ghép răng","Việc cấy ghép răng phẫu thuật để thay thế răng bị mất hoặc hỗ trợ răng giả.",No,4
13300,Oral and Maxillofacial Surgery,13304,"Jaw Fracture Repair","Surgical repair of jaw fractures, including wiring and fixation of the jaw bone.","Sửa chữa gãy hàm","Phẫu thuật sửa chữa các gãy hàm, bao gồm buộc dây và cố định xương hàm.",No,4
13300,Oral and Maxillofacial Surgery,13305,"Cleft Lip and Palate Surgery","Surgical repair of cleft lip and palate conditions in children and adults.","Phẫu thuật sửa chữa rạn miệng và ấn độ ở trẻ em và người lớn.","Phẫu thuật điều trị sứt môi, hở hàm ếch ở trẻ em và người lớn.",No,2
13300,Oral and Maxillofacial Surgery,13306,"Facial Trauma Surgery","Surgical treatment of facial injuries and fractures due to accidents or trauma.","Phẫu thuật chấn thương khuôn mặt","Phẫu thuật điều trị các chấn thương và gãy khuôn mặt do tai nạn hoặc chấn thương.",No,1
13300,Oral and Maxillofacial Surgery,13307,"Oral Pathology","Diagnosis and treatment of oral and facial diseases and conditions, including oral cancer.","Nội tiết miệng","Chuẩn đoán và điều trị các bệnh và tình trạng của miệng và khuôn mặt, bao gồm ung thư miệng.",No,2
13300,Oral and Maxillofacial Surgery,13308,"Temporomandibular Joint (TMJ) Disorders","Diagnosis and treatment of TMJ disorders, including jaw pain and dysfunction.","Rối loạn khớp hàm mặt (TMJ)","Chuẩn đoán và điều trị các rối loạn khớp hàm mặt, bao gồm đau và chức năng kém của hàm.",No,1
13300,Oral and Maxillofacial Surgery,13309,"Oral Cancer Surgery","Surgical removal and treatment of oral cancer, including tumor excision and reconstructive surgery.","Phẫu thuật ung thư miệng","Loại bỏ phẫu thuật và điều trị ung thư miệng, bao gồm loại bỏ khối u và phẫu thuật tái tạo.",No,0
13300,Oral and Maxillofacial Surgery,13310,"Dentoalveolar Surgery","Surgical procedures related to teeth and the supporting alveolar bone, including extractions and dental implant placements.","Phẫu thuật răng chói","Các thủ thuật phẫu thuật liên quan đến răng và xương hàm hỗ trợ, bao gồm việc loại bỏ răng và cấy ghép răng.",No,4
13300,Oral and Maxillofacial Surgery,13311,"Sleep Apnea Surgery","Surgical interventions to treat sleep apnea, including uvulopalatopharyngoplasty (UPPP).","Phẫu thuật ngừng thở khi ngủ","Những thủ thuật phẫu thuật để điều trị tình trạng ngừng thở khi ngủ, bao gồm phẫu thuật uvulopalatopharyngoplasty (UPPP).",No,1
13300,Oral and Maxillofacial Surgery,13312,"Salivary Gland Disorders","Diagnosis and treatment of salivary gland disorders, including stone removal and gland excision.","Rối loạn tuyến nước bọt","Chuẩn đoán và điều trị các rối loạn tuyến nước bọt, bao gồm loại bỏ sỏi và phẫu thuật loại bỏ tuyến.",No,2
13300,Oral and Maxillofacial Surgery,13313,"Bone Grafting Procedures","Surgical procedures for bone grafting to support dental implants and enhance bone structure.","Phẫu thuật cấy ghép xương","Các thủ thuật phẫu thuật để cấy ghép xương để hỗ trợ cấy ghép răng và tăng cường cấu trúc xương.",No,0
13300,Oral and Maxillofacial Surgery,13314,"Oral and Facial Infections","Diagnosis and treatment of infections in the oral and facial regions, including abscess drainage.","Nhiễm trùng miệng và khuôn mặt","Chuẩn đoán và điều trị nhiễm trùng ở vùng miệng và khuôn mặt, bao gồm thoát mủ của nang.",No,4
13300,Oral and Maxillofacial Surgery,13315,"Reconstructive Jaw Surgery","Surgical procedures for reconstructing the jaw, including bone grafts and corrective jaw surgery.","Phẫu thuật tái tạo hàm mặt","Các thủ thuật phẫu thuật để tái tạo hàm mặt, bao gồm cấy ghép xương và phẫu thuật chỉnh hình hàm mặt.",No,1
13400,Physical Medicine and Rehabilitation,13401,"Physical Therapy","Rehabilitation through physical therapy, including exercises and techniques to improve mobility and function.","Vật lý trị liệu","Phục hồi qua vật lý trị liệu, bao gồm bài tập và kỹ thuật để cải thiện khả năng di chuyển và chức năng.",No,2
13400,Physical Medicine and Rehabilitation,13402,"Occupational Therapy","Rehabilitation through occupational therapy, focusing on daily living skills and fine motor function.","Trị liệu nghề nghiệp","Phục hồi qua trị liệu nghề nghiệp, tập trung vào kỹ năng sinh hoạt hàng ngày và chức năng cơ tay.",No,1
13400,Physical Medicine and Rehabilitation,13403,"Speech Therapy","Rehabilitation for speech and language disorders, including articulation and communication improvement.","Trị liệu ngôn ngữ","Phục hồi cho các rối loạn ngôn ngữ và nói, bao gồm cải thiện cách phát âm và giao tiếp.",No,2
13400,Physical Medicine and Rehabilitation,13404,"Pain Management","Comprehensive pain management, including medication and non-pharmacological approaches.","Quản lý đau toàn diện","Quản lý đau toàn diện, bao gồm thuốc và các phương pháp không dùng thuốc.",No,2
13400,Physical Medicine and Rehabilitation,13405,"Spinal Cord Injury Rehabilitation","Rehabilitation for individuals with spinal cord injuries, including mobility and function improvement.","Phục hồi chấn thương tủy sống","Phục hồi cho người bị chấn thương tủy sống, bao gồm cải thiện khả năng di chuyển và chức năng.",No,1
13400,Physical Medicine and Rehabilitation,13406,"Amputee Rehabilitation","Rehabilitation for amputees, including prosthetic training and functional improvement.","Phục hồi người mất chân tay","Phục hồi cho người mất chân tay, bao gồm đào tạo sử dụng chân tay giả và cải thiện chức năng.",No,2
13400,Physical Medicine and Rehabilitation,13407,"Stroke Rehabilitation","Rehabilitation for stroke survivors, including mobility and speech therapy.","Phục hồi sau đột quỵ","Phục hồi cho người sống sót sau đột quỵ, bao gồm tập trung vào khả năng di chuyển và trị liệu ngôn ngữ.",No,2
13400,Physical Medicine and Rehabilitation,13408,"Musculoskeletal Pain Management","Management of musculoskeletal pain, including conditions like back pain and joint pain.","Quản lý đau cơ xương khớp","Quản lý đau cơ xương khớp, bao gồm các tình trạng như đau lưng và đau khớp.",No,2
13400,Physical Medicine and Rehabilitation,13409,"Neurological Rehabilitation","Rehabilitation for individuals with neurological conditions, focusing on function and quality of life.","Phục hồi thần kinh","Phục hồi cho những người mắc các bệnh thần kinh, tập trung vào chức năng và chất lượng cuộc sống.",No,2
13400,Physical Medicine and Rehabilitation,13410,"Pediatric Rehabilitation","Rehabilitation for children with disabilities or injuries, tailored to their specific needs.","Phục hồi trẻ em","Phục hồi cho trẻ em có khuyết tật hoặc bị thương tích, phù hợp với nhu cầu cụ thể của họ.",No,2
13400,Physical Medicine and Rehabilitation,13411,"Orthotic and Prosthetic Services","Custom fitting and training for orthotic and prosthetic devices for mobility and function improvement.","Dịch vụ cung cấp thiết bị trợ giúp và chân tay giả","Đo và tạo thiết bị trợ giúp và chân tay giả tùy chỉnh cho việc cải thiện khả năng di chuyển và chức năng.",No,1
